{
  "width": 8,
  "height": 6,
  "household": "newbie",
  "items": [
    { "id": "fridge", "definition": "base:fridge", "x": 0, "y": 0 },
    { "id": "coffee", "definition": "base:coffee", "x": 1, "y": 0 },
    { "id": "television", "definition": "base:television", "x": 3, "y": 0 },
    { "id": "bed", "definition": "base:bed", "x": 7, "y": 0 },
    { "id": "armchair", "definition": "base:armchair", "x": 3, "y": 1 },
    { "id": "rare-gem", "definition": "base:rare-gem", "x": 6, "y": 2 },
    { "id": "chess-set", "definition": "base:chess-set", "x": 1, "y": 4 },
    { "id": "stereo", "definition": "base:stereo", "x": 0, "y": 5 },
    { "id": "toilet", "definition": "base:toilet", "x": 5, "y": 5 },
    { "id": "shower", "definition": "base:shower", "x": 7, "y": 5 },
    { "id": "aquarium", "definition": "newbie-extras:aquarium", "x": 4, "y": 3 },
    { "id": "haunted-radio", "definition": "broken-gadgets:haunted-radio", "x": 2, "y": 2 },
    { "id": "cursed-lamp", "definition": "broken-gadgets:cursed-lamp", "x": 2, "y": 5 },
    { "id": "glitchy-toaster", "definition": "broken-gadgets:glitchy-toaster", "x": 5, "y": 0 }
  ],
  "sims": [
    { "id": "bob", "name": "Bob", "relationship": 30, "x": 0, "y": 3,
      "motives": { "hunger": 25, "energy": 70, "hygiene": 80, "bladder": 60, "social": 55, "fun": 40 } },
    { "id": "betty", "name": "Betty", "relationship": 50, "x": 7, "y": 3,
      "motives": { "hunger": 65, "energy": 45, "hygiene": 20, "bladder": 70, "social": 60, "fun": 50 } }
  ]
}
